keyword,language
soft close drawer slides,en
undermount drawer slides,en
heavy duty drawer slides,en
bottom mount drawer slides,en
blum undermount drawer slides,en
bottom drawer slides,en
how to measure for undermount roller drawer slides,en
side mount drawer slides,en
drawer slide bracket,en
drawer slides bottom mount,en
blumotion drawer slides,en
drawer slides undermount,en
full extension drawer slides,en
ball bearing drawer slides,en
center mount drawer slides,en
draw slides,en
drawer slides side mount,en
soft stop drawer slides,en
types of drawer slides,en
wooden drawer slides,en
truck bed drawer slides,en
under mount drawer slides,en
drawing a slide,en
how to measure drawer slides,en
push to open drawer slides,en
side mount drawer slide,en
soft closing drawer slides,en
under drawer slides,en
undermount drawer slide,en
wood drawer slides,en
ball bearing slide drawer,en
center mount drawer slide,en
draw cells from the gram stained slide,en
drawer slide jig,en
drawer slides heavy duty,en
heavy duty drawer slides bottom mount,en
heavy duty undermount drawer slides,en
how to release drawer slides,en
pantry drawer slides,en
salice drawer slides,en
self closing drawer slides,en
slide drawing,en
soft close undermount drawer slides,en
water slide drawing,en
blum tandem drawer slides,en
bottom mounted drawer slides,en
drawer slides for dresser,en
drawing of a slide,en
dresser drawer slide glides,en
full extended drawer slides,en
how to fix drawer slides,en
locking drawer slides,en
top mount drawer slides,en
undermount soft close drawer slides,en
12 inch drawer slides,en
best drawer slide jig,en
bottom mount drawer slide,en
bottom mount drawer slides heavy duty,en
diy drawer slides,en
drawer slide rear mounting bracket,en
dresser drawer slide guides,en
how to measure for drawer slides,en
long drawer slides,en
pickup bed drawer slides,en
rv drawer slides,en
side mount soft close drawer slides,en
underneath drawer slides,en
wood on wood drawer slides,en
woodworking drawer slides,en
12 drawer slides,en
22 drawer slides,en
22 inch drawer slides,en
best drawer slides,en
bureau drawer slides,en
drawer slide types,en
drawer slides for metal drawers,en
drawer slides types,en
dtc drawer slides,en
how do you measure drawer slides,en
how to draw a slide,en
husky tool box drawer slides,en
installing undermount drawer slides,en
slider drawing,en
soft close drawer slide,en
tool box drawer slides,en
undermount drawer slides heavy duty,en
16 drawer slides,en
best soft close drawer slides,en
blumotion soft close drawer slides,en
craftsman tool box drawer slides,en
drawer slide installation,en
how to measure a drawer slide,en
industrial drawer slides,en
lockable drawer slides,en
old style plastic drawer slides,en
replace drawer slides,en
stainless steel drawer slides,en
trash drawer slides,en
24 inch drawer slides,en
500 lb drawer slides,en
best asian brand drawer slides,en
blum side mount drawer slides,en
brackets for drawer slides,en
drawer bottom slides,en
drawer slide bottom mount,en
drawer slide lubricant,en
drawer slide sockets,en
drawer slide tape,en
drawer wooden slides,en
drawing of an bear going down a playground slide,en
drawing of slide,en
dresser drawer slide,en
everbilt drawer slides,en
full extend drawer slides,en
full extension undermount drawer slides,en
garbage can drawer slides,en
heavy duty full extension drawer slides,en
how to draw a water slide,en
how to draw water slide,en
how to install soft close drawer slides,en
how to install undermount drawer slides,en
how to replace drawer slides,en
installing soft close drawer slides,en
k&v drawer slides,en
push to open drawer slide,en
rear mount drawer slides,en
repair drawer slides,en
self close drawer slides,en
stainless drawer slides,en
tool cabinet drawer slides,en
under cabinet drawer slides,en
what length drawer slides do i need,en
what size drawer slides do i need,en
wooden drawer slide,en
22 inch soft close drawer slides,en
23 inch drawer slides,en
24 drawer slides,en
30 inch drawer slides,en
8 drawer slides,en
blum 21 undermount drawer slides,en
blum drawer slides installation,en
blum heavy duty drawer slides,en
blum push to open drawer slides,en
do it yourself drawer slides,en
drawer slide dimensions,en
drawer slide pocket door,en
drawer slides ball bearing,en
drawer slides industrial,en
drawer slides that close slow,en
dtc 533 drawer slides,en
full extension drawer slides soft close,en
grass drawer slides,en
heavy duty drawer slides full extension,en
how do i draw an irregular shape in google slides,en
how to install bottom mount drawer slides,en
how to measure drawer slide,en
longest drawer slides,en
lontan drawer slides,en
measuring for drawer slides,en
parts of a drawer slide,en
pull out drawer slides,en
push open drawer slides,en
rear mount brackets for drawer slides,en
replacing drawer slides,en
replacing drawer slides on dresser,en
roller slide drawer,en
snap on drawer slides,en
soft close blum drawer slides,en
soft close drawer slides side mount,en
soft close heavy duty drawer slides,en
undermount vs side mount drawer slides,en
vertical drawer slides,en
vevor drawer slides,en
15 drawer slides,en
22 soft close drawer slides,en
60 inch drawer slides,en
8 inch drawer slides,en
back mount drawer slides,en
blum drawer slides side mount,en
cabinet draw slides,en
cabinet drawer slides soft close,en
different types of drawer slides,en
diy wooden drawer slides,en
drawer slide replacement,en
drawer slide rollers,en
drawer slide wax,en
drawer slides back mount,en
drawer slides for garbage can,en
drawer slides heavy,en
drawer slides installation,en
dtc drawer slides 533,en
euro drawer slides,en
extra long drawer slides,en
full extension soft close drawer slides,en
furniture drawer slides,en
grease for drawer slides,en
heavy drawer slides,en
how to adjust drawer slides,en
how to draw water slides,en
how to install a drawer slide,en
how to install side mount drawer slides,en
how to make drawer slides,en
installing drawer slides undermount,en
installing side mount drawer slides,en
keyboard drawer slides,en
kreg jig drawer slide jig,en
mounting drawer slides,en
over extension drawer slides,en
plastic dresser drawer slides,en
rear mounting bracket for drawer slide,en
replace kitchen drawer slides,en
rockler undermount drawer slides,en
salice progressa drawer slides,en
side mount vs undermount drawer slides,en
slide out keyboard drawer,en
small drawer slides,en
soft close garbage drawer slides,en
soft closer drawer slides,en
two direction drawer slides,en
underside drawer slides,en
yeezy slides draw,en
yeezy slides drawing,en
1000 lb drawer slides,en
48 inch drawer slides,en
6 drawer slides,en
6 foot drawer slides,en
antique drawer slides,en
aodeli drawer slides,en
ball bearing drawer slide,en
best undermount drawer slides,en
blum tandem undermount drawer slides,en
blum undermount drawer slide instructions,en
blum undermount drawer slides specs,en
bottom mount draw slides,en
bottom mount soft close drawer slides,en
cabinet hardware drawer slides,en
center mount drawer slide for dresser,en
center mount wooden drawer slides,en
craftsman drawer slides,en
craftsman toolbox drawer slides,en
craftsman toolbox replacement drawer slides,en
discount drawer slides,en
draw the letter e as it appears on the slide,en
drawer slide release,en
drawer slides bottom center mount,en
drawer slides for old drawers,en
drawer slides size chart,en
dresser drawer undermount slides,en
dtc 533l drawer slide,en
face frame drawer slides,en
file cabinet drawer slides,en
fixing drawer slides,en
floor mount drawer slides,en
floor mounted drawer slides,en
grant drawer slides,en
heavy duty ball bearing drawer slides,en
heavy duty drawer slides 1000 lbs,en
hidden drawer slides,en
how to add soft close drawer slides,en
how to build a drawer without slides,en
how to change drawer slides,en
how to fix ball bearing drawer slides,en
how to install drawer slides side mount,en
how to make a drawer with slides,en
how to separate drawer slides,en
installing drawer slides on frameless cabinets,en
large drawer slides,en
matco tool box drawer slides,en
mini drawer slides,en
miniature drawer slides,en
old craftsman tool box drawer slides,en
old drawer slides,en
old dresser drawer slides,en
old style drawer slides,en
plastic drawer slide mounts,en
plastic drawer slide replacement parts,en
pull out slide drawer,en
push to open drawer slides soft close,en
push to open soft close drawer slides,en
rear mounted drawer slides,en
release drawer slides,en
reliabilt drawer slides,en
repon drawer slides,en
rocklers drawer slides,en
short drawer slides,en
snap on tool box drawer slides,en
soft close center mount drawer slides,en
soft close side mount drawer slides,en
thin drawer slides,en
top mount drawer slide,en
undermount drawer slides vs side mount,en
vintage drawer slides,en
1000 pound drawer slides,en
13 inch drawer slides,en
16x24 heat press with slide out drawer,en
23 drawer slides,en
28 inch drawer slides,en
28 inch undermount drawer slides,en
36 drawer slides,en
3d printed drawer slides,en
72 inch drawer slides,en
accuride drawer slides removal,en
adjust blum drawer slides,en
adjustable drawer slides,en
ashley furniture drawer slides,en
best side mount drawer slides,en
blum drawer slide adjustment,en
blum drawer slide jig,en
blum drawer slides instructions,en
blum drawer slides sizes,en
blum movento drawer slides,en
blum undermount drawer slides dimensions,en
blum undermount drawer slides instructions pdf,en
blum undermount drawer slides sizes,en
cabinet drawer slides bottom mount,en
closet drawer slides,en
desk drawer slides,en
drawer slide components,en
drawer slide door,en
drawer slide installation jig,en
drawer slide lengths,en
drawer slide stopper,en
drawer slides 22 inch,en
drawer slides for inset drawers,en
drawer slides for small drawers,en
drawer slides for truck bed,en
drawer slides removal,en
drawer slides sizes,en
drawing on google slides,en
drop down drawer slides,en
dtc soft close drawer slides,en
exterior drawer slides,en
floor mount drawer slide,en
how to fix drawer slides with ball bearings,en
how to insert a google drawing into slides,en
how to install cabinet drawer slides,en
how to make a dresser drawer slide easier,en
how to make wooden drawer slides,en
how to remove a drawer with metal slides,en
how to remove ball bearing drawer slides,en
how to repair ball bearing drawer slides,en
how to replace wooden drawer slides with undermount,en
husky drawer slides,en
ikea drawer slides replacement,en
inexpensive drawer slides,en
inset drawer slides,en
install soft close drawer slides,en
installing blum undermount drawer slides,en
kennedy tool box drawer slides,en
locking drawer slide,en
merillat drawer slide brackets,en
motorized drawer slides,en
outdoor drawer slides,en
overtravel drawer slides,en
rear bracket drawer slide,en
screws for drawer slides,en
sh abc drawer slides,en
side drawer slides,en
slide drawing easy,en
slide out cabinet drawer,en
soft close drawer slides replacement parts,en
soft close kitchen drawer slides,en
troubleshooting drawer slides,en
undermount drawer slides installation,en
unigrass 6600 drawer slides,en
unistrut drawer slides,en
us general drawer slides,en
vanity drawer slides,en
water slide drawing easy,en
what size drawer slides for 24 cabinet,en
wood drawer slide replacement,en
wood drawer slide wax,en
wooden drawer slide lubricant,en
12 soft close drawer slides,en
18 undermount drawer slides,en
22 in soft close drawer slides,en
28 drawer slide,en
28 drawer slides,en
300 lb drawer slides,en
3d printer drawer slides,en
4ft drawer slides,en
500 lb drawer slide,en
accuride drawer slides parts,en
accuride soft close drawer slides,en
accuride undermount drawer slides,en
add drawer slides to old dresser,en
adding drawer slides to old dresser,en
adhesive drawer slides,en
adjusting drawer slides,en
antique dresser drawer slides,en
base mount drawer slides,en
blum 12 undermount drawer slides,en
blum bottom mount drawer slides,en
blum undermount drawer slide installation,en
blum undermount drawer slides 21,en
blum undermount drawer slides manual,en
boke drawer slides,en
bottom mounted drawer slides full extension,en
building drawer slides,en
cabinet undermount drawer slides,en
camping drawer slides,en
center mount drawer slides wood,en
concealed undermount drawer slides,en
craftsman tool box drawer slide upgrade,en
diy drawer slide jig,en
diy wood drawer slides,en
draw in google slides,en
drawer organizer slides,en
drawer side slides,en
drawer slide guide,en
drawer slide locking clip,en
drawer slide locking device,en
drawer slide mounting brackets,en
drawer slide out,en
drawer slide release mechanism,en
drawer slide repair kit,en
drawer slide stops,en
drawer slide wheels,en
drawer slides 1000 lbs,en
drawer slides 18 inch,en
drawer slides extension,en
drawer slides face frame,en
drawer slides for face frame cabinets,en
drawer slides for pull out shelves,en
drawer slides full extension soft close,en
drawer slides problems,en
drawer slides side mount install,en
drawer slides small,en
drawer slides walmart,en
drawer slides with full extension,en
drawer slides with sides,en
drawer soft close slides,en
european drawer slides,en
everbilt undermount drawer slides,en
fix drawer slides,en
flat drawer slides,en
full extension ball bearing drawer slides,en
grass 6600 drawer slides,en
hoone drawer slides,en
how do drawer slides work,en
how to build wooden drawer slides,en
how to draw slides,en
how to fix a jammed drawer slide,en
how to fix dresser drawer slides,en
how to insert google drawing into google slides,en
how to install a drawer slide side mount,en
how to install ball bearing drawer slides,en
how to install blum undermount drawer slides,en
how to install center mount drawer slides,en
how to install drawer slides on old drawers,en
how to measure drawer slide length,en
how to release a drawer slide,en
how to remove drawer from slides,en
how to remove drawer with undermount slides,en
how to remove undermount drawer slides,en
how to take apart drawer slides,en
husky toolbox drawer slides,en
insert drawing google slides,en
insert google drawing into slides,en
install bottom drawer slides,en
install undermount drawer slides,en
installing ball bearing drawer slides,en
installing bottom drawer slides,en
kitchen drawer slides bottom mount,en
kobalt tool box drawer slides,en
kv soft close drawer slides,en
low profile undermount drawer slides,en
lowe's drawer slides,en
lubricant for drawer slides,en
motorised drawer slides,en
movento drawer slides,en
nylon drawer slide tape,en
over travel drawer slides,en
progressa drawer slides,en
red eared slider drawing,en
remove drawer from slides,en
replacement toolbox drawer slides,en
replacing drawer slides with soft close,en
replacing dresser drawer slides,en
rockler drawer slide jig,en
salice f70 drawer slides,en
samsung freezer drawer slide rail,en
skinny drawer slides,en
slides drawer,en
slim drawer slides,en
slow closing drawer slides,en
soft close ball bearing drawer slides,en
soft close cabinet drawer slides,en
soft close drawer slides 20 inch,en
soft close drawer slides installation,en
soft close drawer slides lowes,en
soft close full extension drawer slides,en
soft closing drawer slides problems,en
soft closing undermount drawer slides,en
taiming drawer slides,en
telescoping drawer slides,en
toolbox drawer slides,en
top mounted drawer slides,en
two way drawer slide,en
under desk drawer slides,en
us general tool box drawer slides,en
11 drawer slides,en
12 inch drawer slide,en
14 undermount drawer slides,en
5 foot drawer slides,en
72 drawer slides,en
accuride side mount drawer slides,en
adjusting blum drawer slides,en
blum 15 undermount drawer slides,en
blum 18 undermount drawer slides,en
blum 24 undermount drawer slides,en
blum drawer slides installation instructions,en
blum undermount drawer slides installation,en
blum undermount soft close drawer slides,en
blumotion drawer slides installation instructions,en
bottom center mount drawer slide,en
can you use side mount drawer slides as undermount,en
craftsman tool box drawer slides replacement,en
drawer slide grease,en
drawer slide installation instructions,en
drawer slide jig diy,en
drawer slide jig rockler,en
drawer slide mounting,en
drawer slide rear bracket,en
drawer slide sizes,en
drawer slides for antique dresser,en
drawer slides for snap on tool boxes,en
drawer slides full extension ball bearing,en
drawer slides ikea replacement,en
drawer slides top mount,en
drawing in google slides,en
dresser drawer slides wood,en
dresser drawer wood slides,en
easy slide drawing,en
everbilt drawer slides instructions,en
festool drawer slides,en
frylr jj384814 center mount classic traditional wood drawer slide,en
google slides drawing,en
grease drawer slides,en
heavy duty side mount drawer slides,en
homdiy drawer slides,en
homemade drawer slides,en
horizontal drawer slides,en
how install drawer slides,en
how long should drawer slides be,en
how to determine drawer slide length,en
how to draw in slides,en
how to draw on google slide,en
how to draw on google slides ipad,en
how to draw slide,en
how to fit ball bearing drawer slides,en
how to fix a drawer slide,en
how to fix a kitchen drawer slide,en
how to install drawer slide,en
how to install drawer slides ball bearing,en
how to install full extension drawer slides,en
how to measure drawer slides for replacement,en
how to measure for soft close drawer slides,en
how to repair kitchen drawer slides,en
how to size drawer slides,en
how to take apart a drawer slide,en
ikea plastic drawer slides,en
install side mount drawer slides,en
installing full extension drawer slides,en
kitchen drawer slide bracket,en
kv 8400 drawer slides,en
kv 8500 drawer slides,en
lube for drawer slides,en
mac tool box drawer slides,en
measuring drawer slides,en
salice push to open drawer slides,en
salice undermount drawer slides installation instructions,en
sikai drawer slides,en
single track drawer slide,en
slide drawer microwave,en
slide drawer organizer,en
slimline drawer slides,en
soft close drawer slides retrofit,en
soft close vs self close drawer slides,en
super extension drawer slides,en
undermount vs bottom mount drawer slides,en
vintage metal drawer slides,en
water slides drawing,en
wooden drawer slides diy,en
yeezy slide drawing,en
16 inch undermount drawer slides,en
21 blum undermount drawer slides,en
21 inch undermount drawer slides,en
22 inch bottom mount drawer slides,en
23 inch drawer slides side mount,en
8 drawer slide,en
aluminum drawer slides,en
ball bearing slides drawer,en
best drawer slide,en
best heavy duty drawer slides,en
best side mount soft close drawer slides,en
best slow close drawer slides,en
blue point tool box drawer slides,en
blum 30 inch drawer slides,en
blum drawer slide dimensions,en
blum soft close undermount drawer slides,en
blum tandem plus drawer slides,en
blum undermount drawer slides 18,en
cabinet drawer slide bracket,en
can you use side mount drawer slides on the bottom,en
craftsman drawer slide replacement,en
double drawer slides,en
dovetail drawer slide,en
drawer boxes with slides,en
drawer slide manufacturer,en
drawer slide manufacturers,en
drawer slide measurements,en
drawer slide rollers and wheels,en
drawer slide shims,en
drawer slides brackets,en
drawer slides for husky toolbox,en
drawer slides for vertical drawers,en
drawer slides full extension heavy duty,en
drawer slides slow close,en
drawer slides two way,en
drawer slides with soft close,en
drawing of a playground slide,en
everbilt drawer slides installation,en
everbilt full extension drawer slides,en
grass undermount drawer slides,en
gtv drawer slides,en
heavy duty long drawer slides,en
homak tool box replacement drawer slides,en
how do you draw in google slides,en
how to add drawing to google slides,en
how to adjust blum drawer slides,en
how to fit drawer slides,en
how to install drawer slides on face frame cabinets,en
how to lubricate drawer slides,en
how to remove dresser drawer with center metal slide,en
how to remove dresser drawer with wooden center slide,en
how to repair a dresser drawer slide,en
how to take drawer slides apart,en
how to use kreg drawer slide jig,en
häfele drawer slides how to remove,en
install blum undermount drawer slides,en
installing center mount drawer slides,en
kitchenaid freezer drawer slide rail,en
kreg drawer slide,en
kv drawer slides 8400,en
linear drawer slides,en
long drawer slides for truck bed,en
lubricant for wooden drawer slides,en
lubricate drawer slides,en
lubricating drawer slides,en
metal drawer slide lubricant,en
microscope slide drawing worksheet,en
playground slide drawing,en
rear mounting drawer slides,en
red eared slider turtle drawing,en
repairing drawer slides,en
rv drawer slides stay closed,en
shimming drawer slides,en
side mount ball bearing drawer slides,en
side mount drawer slide installation,en
side mount drawer slides installation,en
simple drawer slides,en
slide and tilt drawer,en
slide easy drawing,en
soft close dresser drawer slides,en
tilting drawer slides,en
toe kick drawer slides,en
under desk drawer slide,en
undermount drawer slide rear mounting bracket,en
undermount drawer slides for cabinets,en
wax for drawer slides,en
where are blum drawer slides made,en
whirlpool freezer drawer slide rail,en
white lithium grease for drawer slides,en
wood drawer slide lubricant,en
wurth drawer slides,en
13 3 4 drawer slides,en
14 inch center mount drawer slides,en
15 inch drawer slide,en
18 soft close drawer slides,en
20 inch undermount drawer slides,en
21 soft close undermount drawer slides,en
22 full extension drawer slides,en
36 drawer slides heavy duty,en
60 in drawer slides,en
80/20 drawer slides,en
accuride drawer slide removal,en
accuride drawer slides troubleshooting,en
accuride full extension drawer slides,en
accuride push to open drawer slides,en
adding drawer slides to old kitchen cabinets,en
adjust drawer slides,en
adjusting side mount drawer slides,en
amazon soft close drawer slides,en
baidice drawer slides,en
ball bearing side mount drawer slide,en
beeswax for drawer slides,en
best cabinet drawer slides,en
best drawer slides for dresser,en
best drawer slides for trash cans,en
best lubricant for drawer slides,en
blum 14 undermount drawer slides,en
blum 15 inch undermount drawer slides,en
blum 24 inch undermount drawer slides,en
blum 563f drawer slides,en
blum blumotion drawer slides,en
blum push open drawer slides,en
blum tandem soft close drawer slides,en
bottom mount cabinet drawer slides,en
bottom mount types of drawer slides,en
cabinet drawer slide hardware,en
center mount drawer slides heavy duty,en
centerline drawer slides,en
closetmaid drawer slides,en
concealed drawer slide,en
double slide drawer,en
drawer ball bearing slides,en
drawer slide glides,en
drawer slide hinge,en
drawer slide length,en
drawer slide mechanism,en
drawer slide supplier,en
drawer slide thickness,en
drawer slide track,en
drawer slide underneath,en
drawer slides 32,en
drawer slides dimensions,en
drawer slides side mount soft close,en
drawer slides suppliers,en
drawer slides that mount to bottom of cabinet,en
drawer slides vertical,en
drawing slide,en
drawing slide show,en
drop down drawer slide,en
dtc 533 l drawer slides,en
dtc 533 r drawer slides,en
easiest drawer slides to install,en
extension drawer slides,en
filing cabinet drawer slides,en
full length drawer slides,en
garbage drawer slides repair,en
heavy duty cabinet drawer slides,en
heavy duty drawer slides for truck bed,en
heavy duty kitchen drawer slides,en
heavy duty rv drawer slides,en
heavy duty stainless steel drawer slides,en
heavy duty trash drawer slides,en
heavy duty undermount drawer slides full extension,en
high quality drawer slides,en
hinged drawer slides,en
how to choose drawer slide length,en
how to install draw slides,en
how to make a wood drawer slide easier,en
how to make a wooden drawer slide easier,en
infinity drawer slides,en
installing a drawer slide,en
installing cabinet drawer slides,en
kobalt drawer slides,en
lowes soft close drawer slides,en
lubricate wooden drawer slides,en
lubricating wooden drawer slides,en
marine drawer slides,en
matco drawer slides,en
maytag refrigerator drawer slide rail,en
metal drawer slides center track,en
motorized drawer slide,en
overtravel drawer slide,en
ovis drawer slides,en
pass through drawer slides,en
plastic drawer slide parts,en
pride industrial drawer slides,en
push to open drawer slides with soft close,en
replace wooden drawer slides,en
replacing kitchen drawer slides,en
repon soft close drawer slides,en
richelieu undermount drawer slides,en
roller drawer slide,en
salice drawer slides progressa,en
salice f70 undermount drawer slides,en
salice progressa plus drawer slides,en
shim drawer slides,en
sikai premium drawer slides,en
single drawer slide,en
sizing drawer slides,en
slide drawer tool box,en
soft close drawer slide installation,en
soft close drawer slides amazon,en
soft close drawer slides for face frame cabinets,en
swisco drawer slides,en
teflon drawer slides,en
toolbox drawer slide replacement,en
two way travel drawer slides,en
type of drawer slides,en
types of drawer slide,en
types of side mount drawer slides,en
under bed drawer slides,en
undermount drawer slide installation,en
undermount drawer slides 22,en
undermount drawer slides for face frame cabinets,en
wax for wood drawer slides,en
